{
  "$schema": "./schemas/package.schema.json",
  "name": "",
  "template": "static-website-aws",
  "templateVersion": "0.1.0",
  "configuration": {},
  "deployments": [
    {
      "name": "prod",
      "awsRegion": "us-west-2",
      "awsUser": "goldstack-dev",
      "configuration": {
        "defaultCacheDuration": 1,
        "hostedZoneDomain": "dev.goldstack.party",
        "websiteDomain": "static-website-aws-new.templates.dev.goldstack.party",
        "websiteDomainRedirect": "www.static-website-aws-new.templates.dev.goldstack.party"
      },
      "tfStateKey": "-prod-78892dc49d3d7e525613.tfstate",
      "tfVersion": "1.14.7"
    }
  ]
}
