{
  "$schema": "./schemas/package.schema.json",
  "name": "nextjs",
  "template": "nextjs",
  "templateVersion": "0.1.0",
  "configuration": {},
  "deployments": [
    {
      "name": "prod",
      "awsRegion": "us-west-2",
      "awsUser": "goldstack-dev",
      "configuration": {
        "hostedZoneDomain": "dev.goldstack.party",
        "websiteDomain": "app-nextjs-v2.templates.dev.goldstack.party",
        "defaultCacheDuration": 10
      },
      "tfVersion": "1.10"
    }
  ]
}