{
  "$schema": "./schemas/package.schema.json",
  "name": "app-nextjs-bootstrap",
  "template": "app-nextjs-bootstrap",
  "templateVersion": "0.1.0",
  "configuration": {},
  "deployments": [
    {
      "name": "prod",
      "awsRegion": "us-west-2",
      "awsUser": "goldstack-dev",
      "configuration": {
        "hostedZoneDomain": "dev.goldstack.party",
        "websiteDomain": "app-nextjs-bootstrap-v3.templates.dev.goldstack.party",
        "defaultCacheDuration": 10
      },
      "tfVersion": "1.14.7",
      "tfStateKey": "app-nextjs-bootstrap-prod-29681a140678b488eb62.tfstate"
    }
  ]
}
