{
  "$schema": "./schemas/package.schema.json",
  "name": "app-nextjs",
  "template": "app-nextjs",
  "templateVersion": "0.1.0",
  "configuration": {},
  "deployments": [
    {
      "name": "prod",
      "awsRegion": "us-west-2",
      "awsUser": "goldstack-dev",
      "configuration": {
        "hostedZoneDomain": "dev.goldstack.party",
        "websiteDomain": "app-nextjs-v2.templates.dev.goldstack.party",
        "defaultCacheDuration": 10
      },
      "tfStateKey": "app-nextjs-prod-bfe30e556c467437d714.tfstate",
      "tfVersion": "1.14.7"
    }
  ]
}
